{
  "$schema": "https://json-schema.org/draft/2020-12/schema",
  "$id": "https://awg.local/contracts/world-entities/place.schema.json",
  "title": "Place",
  "type": "object",
  "properties": {
    "schema_version": {
      "$ref": "https://awg.local/contracts/common/common.schema.json#/$defs/version"
    },
    "place_id": {
      "type": "string"
    },
    "place_type": {
      "type": "string"
    },
    "names": {
      "type": "array",
      "minItems": 1,
      "items": {
        "type": "object",
        "properties": {
          "value": {
            "type": "string"
          },
          "language": {
            "type": [
              "string",
              "null"
            ]
          },
          "primary": {
            "type": "boolean"
          }
        },
        "required": [
          "value",
          "primary"
        ],
        "additionalProperties": false
      }
    },
    "geometry_refs": {
      "type": "array",
      "minItems": 1,
      "items": {
        "type": "string"
      }
    },
    "parent_place_ids": {
      "type": "array",
      "items": {
        "type": "string"
      }
    },
    "access_rules": {
      "type": "array",
      "items": {
        "type": "object"
      }
    },
    "provenance": {
      "type": "array",
      "minItems": 1,
      "items": {
        "$ref": "https://awg.local/contracts/common/common.schema.json#/$defs/provenanceRef"
      }
    }
  },
  "required": [
    "schema_version",
    "place_id",
    "place_type",
    "names",
    "geometry_refs",
    "provenance"
  ],
  "additionalProperties": false
}
